{"schema_version":1,"bank_version":"v1","surface":{"id":3,"key":"fields"},"snapshot":{"date":"2026-09-01","notes":"Primary mature providers are mapped across six canonical capability families; specialist/long-tail ecosystems receive explicit direct or compatibility coverage. Non-applicable means outside that provider's material audited role for this snapshot."},"status":"MARKET_AUDITED","required_families":["field_definition","composition_behavior","data_model","api_integration","governance_editor","portability_extensibility"],"primary_providers":[{"id":"acf","name":"Advanced Custom Fields (ACF)","evidence":["https://www.advancedcustomfields.com/resources/creating-a-field-group/","https://www.advancedcustomfields.com/resources/schema-org-property-mapping/","https://www.advancedcustomfields.com/resources/abilities-api/"],"family_map":{"field_definition":["fields.field.type","fields.field.required","fields.field.return_format"],"composition_behavior":["fields.type.repeater","fields.behavior.conditional_enabled","fields.group.location.enabled"],"data_model":["fields.group.storage.mode","fields.type.relationship"],"api_integration":["fields.field.show_in_rest","fields.market.block_bindable","fields.marketaudit.schema_org_property","fields.marketaudit.schema_org_output_format","fields.marketaudit.group_ai_access","fields.marketaudit.group_ai_description"],"governance_editor":["fields.group.presentation.style","fields.market.access_view_roles","fields.market.group_categories"],"portability_extensibility":["fields.market.sync_json","fields.market.export_json","fields.market.extension_api"]},"non_applicable_families":[]},{"id":"secure_custom_fields","name":"Secure Custom Fields","evidence":["https://developer.wordpress.org/secure-custom-fields/features/field/"],"family_map":{"field_definition":["fields.field.type","fields.field.required","fields.field.return_format"],"composition_behavior":["fields.type.repeater","fields.behavior.conditional_enabled","fields.group.location.enabled"],"data_model":["fields.group.storage.mode","fields.type.relationship"],"api_integration":["fields.field.show_in_rest","fields.market.block_bindable"],"governance_editor":["fields.group.presentation.style","fields.market.access_view_roles","fields.market.group_categories"]},"non_applicable_families":["portability_extensibility"]},{"id":"meta_box","name":"Meta Box","evidence":["https://docs.metabox.io/fields/","https://docs.metabox.io/extensions/mb-custom-table/"],"family_map":{"field_definition":["fields.field.type","fields.field.required","fields.field.return_format"],"composition_behavior":["fields.type.repeater","fields.behavior.conditional_enabled","fields.group.location.enabled"],"data_model":["fields.behavior.storage_custom_table","fields.group.storage.custom_table","fields.type.relationship"],"api_integration":["fields.field.show_in_rest","fields.market.block_bindable"],"governance_editor":["fields.group.presentation.style","fields.market.access_view_roles","fields.market.group_categories"],"portability_extensibility":["fields.compat.mapping_preview","fields.market.extension_api"]},"non_applicable_families":[]},{"id":"pods","name":"Pods","evidence":["https://wordpress.org/plugins/pods/","https://docs.pods.io/advanced-topics/rest-api/"],"family_map":{"field_definition":["fields.field.type","fields.market.field_unique","fields.field.return_format"],"composition_behavior":["fields.type.repeater","fields.behavior.conditional_enabled","fields.group.location.enabled"],"data_model":["fields.group.storage.mode","fields.behavior.storage_custom_table","fields.type.relationship"],"api_integration":["fields.marketaudit.rest_readable","fields.marketaudit.rest_writable","fields.marketaudit.relation_rest_response_type","fields.marketaudit.relation_rest_depth"],"governance_editor":["fields.market.access_view_roles","fields.market.access_edit_roles","fields.group.presentation.style"],"portability_extensibility":["fields.compat.pods_import","fields.market.extension_api"]},"non_applicable_families":[]},{"id":"cmb2","name":"CMB2","evidence":["https://github.com/CMB2/CMB2"],"family_map":{"field_definition":["fields.field.type","fields.field.required","fields.field.return_format"],"composition_behavior":["fields.type.repeater","fields.behavior.repeat_clone"],"data_model":["fields.group.storage.mode"],"governance_editor":["fields.group.presentation.style"],"portability_extensibility":["fields.compat.cmb2_import","fields.market.extension_api"]},"non_applicable_families":["api_integration"]},{"id":"carbon_fields","name":"Carbon Fields","evidence":["https://github.com/htmlburger/carbon-fields"],"family_map":{"field_definition":["fields.field.type","fields.field.required","fields.field.return_format"],"composition_behavior":["fields.type.repeater","fields.behavior.conditional_enabled"],"data_model":["fields.group.storage.mode","fields.type.relationship"],"governance_editor":["fields.group.presentation.style"],"portability_extensibility":["fields.compat.carbon_fields_import","fields.market.extension_api"]},"non_applicable_families":["api_integration"]},{"id":"fieldmanager","name":"Fieldmanager","evidence":["https://github.com/alleyinteractive/wordpress-fieldmanager"],"family_map":{"field_definition":["fields.field.type","fields.behavior.validation_custom_provider","fields.behavior.sanitize_provider"],"composition_behavior":["fields.behavior.repeat_clone","fields.behavior.repeat_sort"],"data_model":["fields.group.storage.mode"],"governance_editor":["fields.group.presentation.style"],"portability_extensibility":["fields.compat.fieldmanager_import","fields.market.extension_api"]},"non_applicable_families":["api_integration"]},{"id":"jetengine","name":"JetEngine","evidence":["https://crocoblock.com/knowledge-base/features/meta-field-types-overview/","https://crocoblock.com/knowledge-base/features/custom-content-type/"],"family_map":{"field_definition":["fields.field.type","fields.field.required","fields.field.return_format"],"composition_behavior":["fields.type.repeater","fields.market.choice_glossary","fields.market.choice_query"],"data_model":["fields.behavior.storage_custom_table","fields.market2.relation_custom_table","fields.type.relationship"],"api_integration":["fields.field.show_in_rest","fields.market.block_bindable"],"governance_editor":["fields.market2.target_admin_list","fields.group.presentation.style"],"portability_extensibility":["fields.compat.mapping_preview","fields.market.extension_api"]},"non_applicable_families":[]},{"id":"redux","name":"Redux Framework","evidence":["https://github.com/reduxframework/redux-framework"],"family_map":{"field_definition":["fields.type.typography","fields.type.spacing","fields.type.border","fields.type.background","fields.type.gradient"],"composition_behavior":["fields.behavior.conditional_enabled"],"data_model":["fields.group.storage.mode"],"governance_editor":["fields.market.settings_changed","fields.market.settings_reset"],"portability_extensibility":["fields.compat.mapping_preview","fields.market.extension_api"]},"non_applicable_families":["api_integration"]},{"id":"acf_extended","name":"ACF Extended","evidence":["https://wordpress.org/plugins/acf-extended/"],"family_map":{"composition_behavior":["fields.market.location_override","fields.market.location_override_rules"],"api_integration":["fields.market.block_bindable","fields.market.group_as_block"],"governance_editor":["fields.market.group_access_roles","fields.market.group_categories","fields.market.raw_inspector"],"portability_extensibility":["fields.compat.acf_extended_import","fields.market.sync_json","fields.market.sync_php"]},"non_applicable_families":["field_definition","data_model"]},{"id":"toolset_types","name":"Toolset Types","evidence":["https://toolset.com/home/types-manage-post-types-taxonomy-and-custom-fields/"],"family_map":{"field_definition":["fields.field.type","fields.field.required","fields.field.return_format"],"composition_behavior":["fields.type.repeater","fields.behavior.validation_required"],"data_model":["fields.type.relationship","fields.group.storage.mode"],"governance_editor":["fields.group.presentation.style"],"portability_extensibility":["fields.compat.toolset_types_import"]},"non_applicable_families":["api_integration"]},{"id":"acpt","name":"ACPT","evidence":["https://acpt.io/features/"],"family_map":{"field_definition":["fields.field.type","fields.field.required","fields.field.return_format"],"composition_behavior":["fields.type.repeater","fields.type.flexible_content","fields.type.clone","fields.behavior.conditional_enabled"],"data_model":["fields.group.storage.custom_table","fields.type.relationship","fields.marketaudit.custom_table_foreign_keys"],"api_integration":["fields.field.show_in_rest","fields.market.block_bindable"],"governance_editor":["fields.market.access_view_roles","fields.group.presentation.style"],"portability_extensibility":["fields.compat.acpt_import","fields.market.extension_api"]},"non_applicable_families":[]}],"specialist_providers":[{"id":"smart_custom_fields","name":"Smart Custom Fields","evidence":["https://wordpress.org/plugins/smart-custom-fields/","https://github.com/inc2734/smart-custom-fields"],"bank_record_ids":["fields.compat.smart_custom_fields_import","fields.field.type","fields.type.repeater"]},{"id":"wck","name":"WCK Custom Fields Creator","evidence":["https://wordpress.org/plugins/wck-custom-fields-and-custom-post-types-creator/"],"bank_record_ids":["fields.compat.wck_import","fields.field.type","fields.type.repeater"]},{"id":"atshift_fields","name":"atshift Fields / CFS compatibility","evidence":["https://wordpress.org/plugins/atshift-fields-maintenance-for-custom-field-suite/"],"bank_record_ids":["fields.compat.cfs_atshift_import","fields.field.type","fields.type.repeater"]},{"id":"modern_fields","name":"Modern Fields","evidence":["https://wordpress.org/plugins/modern-fields/"],"bank_record_ids":["fields.compat.modern_fields_import","fields.field.type","fields.market.block_bindable"]},{"i